{
  "schema_version": "1.0.0",
  "title": "APIsr",
  "checked_on": "2026-10-13",
  "timezone": "Asia/Baghdad",
  "scope_ar": "خدمات مجانية بحصص متجددة أو وصول عام مستمر بلا رصيد استخدام مدفوع؛ ليست ضمانًا لتوفر غير محدود أو مجانية كل خصائص المزود.",
  "total_services": 110,
  "category_counts": {
    "ai": 4,
    "backend": 9,
    "blockchain": 4,
    "books": 1,
    "calendar": 2,
    "content": 2,
    "culture": 1,
    "development": 4,
    "email": 4,
    "entertainment": 1,
    "environment": 2,
    "finance": 9,
    "food": 3,
    "games": 2,
    "geolocation": 10,
    "government": 5,
    "images": 4,
    "knowledge": 1,
    "language": 3,
    "media": 4,
    "media_processing": 3,
    "messaging": 4,
    "multi_domain": 1,
    "news": 3,
    "ocr": 1,
    "science": 3,
    "search": 4,
    "security": 3,
    "sports": 2,
    "validation": 5,
    "weather": 6
  },
  "free_type_counts": {
    "recurring_quota": 90,
    "unmetered_public": 20
  },
  "services": [
    {
      "id": "cloudflare-workers-ai",
      "name": "Cloudflare Workers AI",
      "category": "ai",
      "category_ar": "الذكاء الاصطناعي",
      "auth": "account_token",
      "free_type": "recurring_quota",
      "price_usd_within_free_scope": 0,
      "quota": "10000 neurons/day on Workers Free",
      "reset": "day; 00:00 UTC",
      "base_url": "https://api.cloudflare.com/client/v4/accounts/{account_id}/ai/run/",
      "get_access_url": "https://dash.cloudflare.com/",
      "credit_card_required": null,
      "credit_card_evidence": "not_confirmed",
      "commercial_use": "unknown",
      "limitations_ar": "ليست neurons عدد tokens أو طلبات؛ بعض النماذج تتطلب الدفع وتستبعد؛ تجاوز المجاني يفشل ولا يستمر دون ترقية.",
      "verification": {
        "status": "official_documentation_reviewed",
        "checked_on": "2026-10-13",
        "timezone": "Asia/Baghdad",
        "evidence": [
          {
            "url": "https://developers.cloudflare.com/workers-ai/platform/pricing/",
            "kind": "official_pricing_or_documentation",
            "checked_on": "2026-10-13",
            "method": "direct_https_read",
            "http_status": 200,
            "retrieved_at": "2026-10-12T20:57:04Z",
            "content_sha256": "11f338b3978366299547a34b140a359886b39c0b1a52b01b9c6dc1bc03b82780"
          }
        ],
        "live_key_tested": false
      },
      "discovered_from": [
        "https://github.com/12britz/awesome-free-models",
        "https://github.com/public-apis/public-apis",
        "https://github.com/ripienaar/free-for-dev"
      ],
      "discovery_route": "repository_and_provider_verification",
      "private_credentials_included": false
    },
    {
      "id": "google-gemini-developer-api",
      "name": "Google Gemini Developer API",
      "category": "ai",
      "category_ar": "الذكاء الاصطناعي",
      "auth": "api_key",
      "free_type": "recurring_quota",
      "price_usd_within_free_scope": 0,
      "quota": "Free input/output for eligible models; RPM, TPM and RPD depend on model and project",
      "reset": "minute/day",
      "base_url": "https://generativelanguage.googleapis.com/v1beta",
      "get_access_url": "https://aistudio.google.com/apikey",
      "credit_card_required": null,
      "credit_card_evidence": "not_confirmed",
      "commercial_use": "restricted",
      "limitations_ar": "اختر نموذجًا يظهر Free of charge؛ حدود الطلبات يوميًا تتجدد بتوقيت المحيط الهادئ؛ المحتوى قد يستخدم لتحسين المنتجات؛ توجد قيود جغرافية وعمرية.",
      "verification": {
        "status": "official_documentation_reviewed",
        "checked_on": "2026-10-13",
        "timezone": "Asia/Baghdad",
        "evidence": [
          {
            "url": "https://ai.google.dev/gemini-api/docs/pricing",
            "kind": "official_pricing_or_documentation",
            "checked_on": "2026-10-13",
            "method": "web_reader",
            "note_ar": "قرئت الصفحة الرسمية عبر أداة الويب؛ لم تُحفظ بصمة HTML محلية."
          },
          {
            "url": "https://ai.google.dev/gemini-api/docs/rate-limits",
            "kind": "official_pricing_or_documentation",
            "checked_on": "2026-10-13",
            "method": "direct_https_read",
            "http_status": 200,
            "retrieved_at": "2026-10-12T20:57:05Z",
            "content_sha256": "9848f9ce83b49006e4af0a918ccb1bbdddba00a78209e5bc88688390feea09c9"
          }
        ],
        "live_key_tested": false
      },
      "discovered_from": [
        "https://github.com/12britz/awesome-free-models",
        "https://github.com/public-apis/public-apis",
        "https://github.com/ripienaar/free-for-dev"
      ],
      "discovery_route": "repository_and_provider_verification",
      "private_credentials_included": false
    },
    {
      "id": "groq",
      "name": "Groq",
      "category": "ai",
      "category_ar": "الذكاء الاصطناعي",
      "auth": "api_key",
      "free_type": "recurring_quota",
      "price_usd_within_free_scope": 0,
      "quota": "Model-dependent RPM, RPD, TPM and TPD; example gpt-oss-120b: 30 RPM, 1000 RPD, 8000 TPM, 200000 TPD",
      "reset": "minute/day",
      "base_url": "https://api.groq.com/openai/v1",
      "get_access_url": "https://console.groq.com/keys",
      "credit_card_required": null,
      "credit_card_evidence": "not_confirmed",
      "commercial_use": "unknown",
      "limitations_ar": "الحدود على مستوى المؤسسة وتختلف بالنموذج؛ راجع لوحة Limits؛ المجاني لا يشمل كل ميزات الخطة المدفوعة.",
      "verification": {
        "status": "official_documentation_reviewed",
        "checked_on": "2026-10-13",
        "timezone": "Asia/Baghdad",
        "evidence": [
          {
            "url": "https://console.groq.com/docs/rate-limits",
            "kind": "official_pricing_or_documentation",
            "checked_on": "2026-10-13",
            "method": "direct_https_read",
            "http_status": 200,
            "retrieved_at": "2026-10-12T20:57:04Z",
            "content_sha256": "1ff1a1a9ddb36f77ce134b66a3d58bfbc34c1e2f4f5911ac8409ce75c14a16bf"
          }
        ],
        "live_key_tested": false
      },
      "discovered_from": [
        "https://github.com/12britz/awesome-free-models",
        "https://github.com/public-apis/public-apis"
      ],
      "discovery_route": "repository_and_provider_verification",
      "private_credentials_included": false
    },
    {
      "id": "mistral-studio-free-mode",
      "name": "Mistral Studio Free mode",
      "category": "ai",
      "category_ar": "الذكاء الاصطناعي",
      "auth": "api_key",
      "free_type": "recurring_quota",
      "price_usd_within_free_scope": 0,
      "quota": "Included monthly usage; model-specific RPS and TPM shown in account Limits",
      "reset": "month/second/minute",
      "base_url": "https://api.mistral.ai/v1",
      "get_access_url": "https://docs.mistral.ai/getting-started/quickstarts/studio/activate-and-generate-api-key",
      "credit_card_required": false,
      "credit_card_evidence": "explicit_or_keyless",
      "commercial_use": "unknown",
      "limitations_ar": "المصدر يثبت الحصة الشهرية لكنه لا ينشر رقمًا موحدًا؛ ابق في Free mode؛ الدفع حسب الاستخدام منفصل.",
      "verification": {
        "status": "official_documentation_reviewed",
        "checked_on": "2026-10-13",
        "timezone": "Asia/Baghdad",
        "evidence": [
          {
            "url": "https://docs.mistral.ai/admin/billing-usage/usage-limits",
            "kind": "official_pricing_or_documentation",
            "checked_on": "2026-10-13",
            "method": "direct_https_read",
            "http_status": 200,
            "retrieved_at": "2026-10-12T21:01:25Z",
            "content_sha256": "af7ead80efb4a85f83dc276af30594b207ae7d30d835edd905dbefcddf4ddeff"
          },
          {
            "url": "https://docs.mistral.ai/getting-started/quickstarts/studio/activate-and-generate-api-key",
            "kind": "official_pricing_or_documentation",
            "checked_on": "2026-10-13",
            "method": "direct_https_read",
            "http_status": 200,
            "retrieved_at": "2026-10-12T21:01:26Z",
            "content_sha256": "26b742f6e34027deb48fd509d1afc83b5b188dc858d12c7381ea1762735d9395"
          }
        ],
        "live_key_tested": false
      },
      "discovered_from": [
        "https://github.com/12britz/awesome-free-models",
        "https://github.com/public-apis/public-apis"
      ],
      "discovery_route": "repository_and_provider_verification",
      "private_credentials_included": false
    },
    {
      "id": "airtable",
      "name": "Airtable",
      "category": "backend",
      "category_ar": "الخدمات الخلفية وقواعد البيانات",
      "auth": "account_token",
      "free_type": "recurring_quota",
      "price_usd_within_free_scope": 0,
      "quota": "1000 API calls/workspace/month; 5 requests/second/base",
      "reset": "month/second",
      "base_url": "https://api.airtable.com/v0",
      "get_access_url": "https://airtable.com/create/tokens",
      "credit_card_required": null,
      "credit_card_evidence": "not_confirmed",
      "commercial_use": "unknown",
      "limitations_ar": "Free workspace؛ PAT مع أضيق نطاق للقاعدة؛ حد شهري مشترك بين المستخدمين؛ عدد السجلات والملفات محدود.",
      "verification": {
        "status": "official_documentation_reviewed",
        "checked_on": "2026-10-13",
        "timezone": "Asia/Baghdad",
        "evidence": [
          {
            "url": "https://support.airtable.com/docs/managing-api-call-limits-in-airtable",
            "kind": "official_pricing_or_documentation",
            "checked_on": "2026-10-13",
            "method": "direct_https_read",
            "http_status": 200,
            "retrieved_at": "2026-10-12T21:00:29Z",
            "content_sha256": "20104e2a2eeab7c6e74d269e80487b0ea0ff4da1e3487466f8382e44756d8833"
          },
          {
            "url": "https://www.airtable.com/pricing",